{
 "experiment": "mock-experiment",
 "spec_sha256": "d1b206acb4b99e5885f61b400f00f06beb492b4aa1ab850abeafafe23da7b817",
 "pins": {
  "scoring_spec": {
   "path": "harness/tools/tests/fixtures/mock-scores/scoring-spec.yaml",
   "sha256": "da3b9f9c4adb9a75f195925abe49d0a24ad690f2333b27df383cb8012c82e1fb"
  },
  "guard_spec": {
   "path": "harness/tools/tests/fixtures/mock-experiment/guard-spec.yaml",
   "version": "0.1",
   "sha256": "84324b465490e566ce0fab9cbee5d53636cf8fe636997bf8c6c39494ddf9ad1d"
  },
  "driver_table": {
   "path": "harness/tools/tests/fixtures/mock-grades/driver-table.yaml",
   "sha256": "04fdb608c64661905af94f1a01e5502f5f84f004cd4c433b9297fc284c99f3de"
  },
  "dataset": {
   "path": "harness/tools/tests/fixtures/mock-experiment/build.manifest.json",
   "sha256": "b60942339c09f9ea6155bdac98c293a8184de082f4fd95f1b9134dee98bdd44f"
  }
 },
 "conditions": [
  "fixed",
  "oracle",
  "random"
 ],
 "telemetry": [
  "names"
 ],
 "seed_count": 2,
 "boot_defaults": {
  "primary": "ostep",
  "alternatives": [
   "alt"
  ]
 },
 "criterion": {
  "type": "k_of_n_gap",
  "k": 1,
  "g": "0.500000",
  "reference": "oracle",
  "compared": "random",
  "seed_statistic": "mean"
 },
 "verdict": "pass",
 "verdict_detail": {
  "met": 1,
  "judging": 1,
  "k": 1,
  "invalid_runs": []
 },
 "gaps": [
  {
   "workload_id": "mock-score",
   "judging": true,
   "boot_default": "",
   "reference_score": "2.500000",
   "compared_scores": [
    {
     "seed": "s1",
     "score": "1.639359"
    },
    {
     "seed": "s2",
     "score": "0.433333"
    }
   ],
   "compared_mean": "1.036346",
   "gap": "0.585462",
   "meets_g": true,
   "all_no_headroom": false,
   "n_no_headroom": 1,
   "n_terms": 4,
   "random_beats_oracle": false,
   "available": true
  },
  {
   "workload_id": "mock-score",
   "judging": true,
   "boot_default": "alt",
   "reference_score": "2.500000",
   "compared_scores": [
    {
     "seed": "s1",
     "score": "1.533876"
    },
    {
     "seed": "s2",
     "score": "0.210172"
    }
   ],
   "compared_mean": "0.872024",
   "gap": "0.651190",
   "meets_g": true,
   "all_no_headroom": false,
   "n_no_headroom": 1,
   "n_terms": 4,
   "random_beats_oracle": false,
   "available": true
  }
 ],
 "scores": [
  {
   "workload_id": "mock-score",
   "condition": "fixed",
   "table": "prior",
   "seed": "",
   "boot_default": "",
   "telemetry": "names",
   "score": "0.500000",
   "weight_sum": "2.500000",
   "n_terms": 4,
   "n_no_headroom": 1,
   "n_censored": 0
  },
  {
   "workload_id": "mock-score",
   "condition": "fixed",
   "table": "prior",
   "seed": "",
   "boot_default": "alt",
   "telemetry": "names",
   "score": "0.500000",
   "weight_sum": "2.500000",
   "n_terms": 4,
   "n_no_headroom": 1,
   "n_censored": 0
  },
  {
   "workload_id": "mock-score",
   "condition": "oracle",
   "table": "prior",
   "seed": "",
   "boot_default": "",
   "telemetry": "names",
   "score": "2.500000",
   "weight_sum": "2.500000",
   "n_terms": 4,
   "n_no_headroom": 1,
   "n_censored": 0
  },
  {
   "workload_id": "mock-score",
   "condition": "oracle",
   "table": "prior",
   "seed": "",
   "boot_default": "alt",
   "telemetry": "names",
   "score": "2.500000",
   "weight_sum": "2.500000",
   "n_terms": 4,
   "n_no_headroom": 1,
   "n_censored": 0
  },
  {
   "workload_id": "mock-score",
   "condition": "random",
   "table": "prior",
   "seed": "s1",
   "boot_default": "",
   "telemetry": "names",
   "score": "1.639359",
   "weight_sum": "2.500000",
   "n_terms": 4,
   "n_no_headroom": 1,
   "n_censored": 0
  },
  {
   "workload_id": "mock-score",
   "condition": "random",
   "table": "prior",
   "seed": "s1",
   "boot_default": "alt",
   "telemetry": "names",
   "score": "1.533876",
   "weight_sum": "2.500000",
   "n_terms": 4,
   "n_no_headroom": 1,
   "n_censored": 0
  },
  {
   "workload_id": "mock-score",
   "condition": "random",
   "table": "prior",
   "seed": "s2",
   "boot_default": "",
   "telemetry": "names",
   "score": "0.433333",
   "weight_sum": "2.500000",
   "n_terms": 4,
   "n_no_headroom": 1,
   "n_censored": 1
  },
  {
   "workload_id": "mock-score",
   "condition": "random",
   "table": "prior",
   "seed": "s2",
   "boot_default": "alt",
   "telemetry": "names",
   "score": "0.210172",
   "weight_sum": "2.500000",
   "n_terms": 4,
   "n_no_headroom": 1,
   "n_censored": 1
  }
 ],
 "provenance": [
  {
   "workload_id": "mock-score",
   "condition": "fixed",
   "table": "",
   "seed": "",
   "boot_default": "",
   "telemetry": "names",
   "fallback_share": "1.000000000000",
   "time_share_clamped": "0.000000000000",
   "time_share_fallback": "1.000000000000",
   "time_share_held": "0.000000000000",
   "time_share_unmodified": "0.000000000000"
  },
  {
   "workload_id": "mock-score",
   "condition": "fixed",
   "table": "",
   "seed": "",
   "boot_default": "alt",
   "telemetry": "names",
   "fallback_share": "1.000000000000",
   "time_share_clamped": "0.000000000000",
   "time_share_fallback": "1.000000000000",
   "time_share_held": "0.000000000000",
   "time_share_unmodified": "0.000000000000"
  },
  {
   "workload_id": "mock-score",
   "condition": "oracle",
   "table": "prior",
   "seed": "",
   "boot_default": "",
   "telemetry": "names",
   "fallback_share": "0.000000000000",
   "time_share_clamped": "0.000000000000",
   "time_share_fallback": "0.000000000000",
   "time_share_held": "0.000000000000",
   "time_share_unmodified": "1.000000000000"
  },
  {
   "workload_id": "mock-score",
   "condition": "random",
   "table": "prior",
   "seed": "s1",
   "boot_default": "",
   "telemetry": "names",
   "fallback_share": "0.000000000000",
   "time_share_clamped": "0.000000000000",
   "time_share_fallback": "0.000000000000",
   "time_share_held": "0.000000000000",
   "time_share_unmodified": "1.000000000000"
  },
  {
   "workload_id": "mock-score",
   "condition": "random",
   "table": "prior",
   "seed": "s2",
   "boot_default": "",
   "telemetry": "names",
   "fallback_share": "0.000000000000",
   "time_share_clamped": "0.000000000000",
   "time_share_fallback": "0.000000000000",
   "time_share_held": "0.000000000000",
   "time_share_unmodified": "1.000000000000"
  }
 ],
 "guards": [
  {
   "workload_id": "mock-score",
   "condition": "fixed",
   "table": "",
   "seed": "",
   "boot_default": "",
   "telemetry": "names",
   "guard": "provenance_share",
   "result": "not_applicable",
   "value": "",
   "threshold": "",
   "partner": "",
   "reason": "",
   "exempt": false,
   "exemption_reason": "",
   "invalidating": false
  },
  {
   "workload_id": "mock-score",
   "condition": "fixed",
   "table": "",
   "seed": "",
   "boot_default": "",
   "telemetry": "names",
   "guard": "config_age",
   "result": "not_applicable",
   "value": "",
   "threshold": "",
   "partner": "",
   "reason": "",
   "exempt": false,
   "exemption_reason": "",
   "invalidating": false
  },
  {
   "workload_id": "mock-score",
   "condition": "fixed",
   "table": "",
   "seed": "",
   "boot_default": "",
   "telemetry": "names",
   "guard": "starvation_floor",
   "result": "pass",
   "value": "20000.000000000000",
   "threshold": "1000000.000000000000",
   "partner": "",
   "reason": "",
   "exempt": false,
   "exemption_reason": "",
   "invalidating": false
  },
  {
   "workload_id": "mock-score",
   "condition": "fixed",
   "table": "",
   "seed": "",
   "boot_default": "",
   "telemetry": "names",
   "guard": "determinism",
   "result": "pass",
   "value": "",
   "threshold": "",
   "partner": "aaaaaaaaaaaaaaaaaaaaaaaaaaaaaaaaaaaaaaaaaaaaaaaaaaaaaaaaaaaaaaaa",
   "reason": "",
   "exempt": false,
   "exemption_reason": "",
   "invalidating": false
  },
  {
   "workload_id": "mock-score",
   "condition": "fixed",
   "table": "",
   "seed": "",
   "boot_default": "",
   "telemetry": "names",
   "guard": "utilisation_sanity",
   "result": "pass",
   "value": "0.600000000000",
   "threshold": "1.000000000000",
   "partner": "",
   "reason": "",
   "exempt": false,
   "exemption_reason": "",
   "invalidating": false
  },
  {
   "workload_id": "mock-score",
   "condition": "fixed",
   "table": "",
   "seed": "",
   "boot_default": "",
   "telemetry": "names",
   "guard": "tick_count",
   "result": "pass",
   "value": "0.000000000000",
   "threshold": "",
   "partner": "",
   "reason": "",
   "exempt": false,
   "exemption_reason": "",
   "invalidating": false
  },
  {
   "workload_id": "mock-score",
   "condition": "fixed",
   "table": "",
   "seed": "",
   "boot_default": "",
   "telemetry": "names",
   "guard": "validation_matches_provenance",
   "result": "not_applicable",
   "value": "",
   "threshold": "",
   "partner": "",
   "reason": "",
   "exempt": false,
   "exemption_reason": "",
   "invalidating": false
  },
  {
   "workload_id": "mock-score",
   "condition": "fixed",
   "table": "",
   "seed": "",
   "boot_default": "",
   "telemetry": "names",
   "guard": "c2_pair",
   "result": "not_applicable",
   "value": "",
   "threshold": "",
   "partner": "",
   "reason": "",
   "exempt": false,
   "exemption_reason": "",
   "invalidating": false
  },
  {
   "workload_id": "mock-score",
   "condition": "fixed",
   "table": "",
   "seed": "",
   "boot_default": "alt",
   "telemetry": "names",
   "guard": "provenance_share",
   "result": "not_applicable",
   "value": "",
   "threshold": "",
   "partner": "",
   "reason": "",
   "exempt": false,
   "exemption_reason": "",
   "invalidating": false
  },
  {
   "workload_id": "mock-score",
   "condition": "fixed",
   "table": "",
   "seed": "",
   "boot_default": "alt",
   "telemetry": "names",
   "guard": "config_age",
   "result": "not_applicable",
   "value": "",
   "threshold": "",
   "partner": "",
   "reason": "",
   "exempt": false,
   "exemption_reason": "",
   "invalidating": false
  },
  {
   "workload_id": "mock-score",
   "condition": "fixed",
   "table": "",
   "seed": "",
   "boot_default": "alt",
   "telemetry": "names",
   "guard": "starvation_floor",